{
  "map_id": "RF-ASSESS-TO-CAP-MAP-001",
  "module": "rectus_femoris",
  "version": "v1_rf_assess_to_cap_map",
  "status": "draft",
  "approval_status": "pending",
  "clinical_approval_status": "not_approved",
  "executable": false,
  "runtime_integration": "none",
  "permitted_use": "evidence_linking_metadata_only",
  "source_assessment_batch": "RF-ASSESS Batch 1 (RF-ASSESS-001..018)",
  "target_capacity_batch": "Universal CAP Batch 1 (CAP-001..015)",
  "signal_types_allowed": [
    "supports_capacity",
    "limits_capacity_confidence",
    "requires_caution",
    "requires_clinician_confirmation",
    "does_not_inform_capacity",
    "safety_context_only",
    "diagnostic_context_only",
    "monitoring_context"
  ],
  "links": [
    {
      "link_id": "LINK-001",
      "assessment_id": "RF-ASSESS-003",
      "assessment_name": "walking_tolerance_check",
      "capacity_id": "CAP-001",
      "capacity_name": "walking_tolerance",
      "signal_type": "supports_capacity",
      "evidence_effect": "may qualitatively inform evidence_state for the target capacity",
      "confidence_effect": "may raise or lower confidence depending on response quality and consistency",
      "goal_sufficiency_effect": "may inform goal-relative sufficiency only; does not clear the user",
      "high_caution_flag": false,
      "requires_clinician_review": false,
      "safety_context_only": false,
      "diagnostic_context_only": false,
      "notes": "Informs evidence only; does not authorize progression, readiness, RTT/RTS, or clearance."
    },
    {
      "link_id": "LINK-002",
      "assessment_id": "RF-ASSESS-004",
      "assessment_name": "stairs_tolerance_check",
      "capacity_id": "CAP-002",
      "capacity_name": "stairs_tolerance",
      "signal_type": "supports_capacity",
      "evidence_effect": "may qualitatively inform evidence_state for the target capacity",
      "confidence_effect": "may raise or lower confidence depending on response quality and consistency",
      "goal_sufficiency_effect": "may inform goal-relative sufficiency only; does not clear the user",
      "high_caution_flag": false,
      "requires_clinician_review": false,
      "safety_context_only": false,
      "diagnostic_context_only": false,
      "notes": "Informs evidence only; does not authorize progression, readiness, RTT/RTS, or clearance."
    },
    {
      "link_id": "LINK-003",
      "assessment_id": "RF-ASSESS-005",
      "assessment_name": "hip_flexion_range_screen",
      "capacity_id": "CAP-008",
      "capacity_name": "hip_flexion_mobility",
      "signal_type": "supports_capacity",
      "evidence_effect": "may qualitatively inform evidence_state for the target capacity",
      "confidence_effect": "may raise or lower confidence depending on response quality and consistency",
      "goal_sufficiency_effect": "may inform goal-relative sufficiency only; does not clear the user",
      "high_caution_flag": false,
      "requires_clinician_review": false,
      "safety_context_only": false,
      "diagnostic_context_only": false,
      "notes": "Informs evidence only; does not authorize progression, readiness, RTT/RTS, or clearance."
    },
    {
      "link_id": "LINK-004",
      "assessment_id": "RF-ASSESS-006",
      "assessment_name": "knee_flexion_tolerance_screen",
      "capacity_id": "CAP-009",
      "capacity_name": "knee_flexion_tolerance",
      "signal_type": "supports_capacity",
      "evidence_effect": "may qualitatively inform evidence_state for the target capacity",
      "confidence_effect": "may raise or lower confidence depending on response quality and consistency",
      "goal_sufficiency_effect": "may inform goal-relative sufficiency only; does not clear the user",
      "high_caution_flag": false,
      "requires_clinician_review": false,
      "safety_context_only": false,
      "diagnostic_context_only": false,
      "notes": "Informs evidence only; does not authorize progression, readiness, RTT/RTS, or clearance."
    },
    {
      "link_id": "LINK-005",
      "assessment_id": "RF-ASSESS-007",
      "assessment_name": "resisted_hip_flexion_response",
      "capacity_id": "CAP-010",
      "capacity_name": "anterior_thigh_tissue_load_tolerance",
      "signal_type": "diagnostic_context_only",
      "evidence_effect": "provides diagnostic-context response evidence relevant to the target capacity",
      "confidence_effect": "may raise or lower confidence depending on response quality and consistency",
      "goal_sufficiency_effect": "may inform goal-relative sufficiency only; does not clear the user",
      "high_caution_flag": false,
      "requires_clinician_review": false,
      "safety_context_only": false,
      "diagnostic_context_only": true,
      "notes": "Diagnostic context only; diagnosis remains with RF-DX/RF-SAF rules. Informs evidence only; no progression, readiness, RTT/RTS, or clearance."
    },
    {
      "link_id": "LINK-006",
      "assessment_id": "RF-ASSESS-008",
      "assessment_name": "resisted_knee_extension_response",
      "capacity_id": "CAP-010",
      "capacity_name": "anterior_thigh_tissue_load_tolerance",
      "signal_type": "diagnostic_context_only",
      "evidence_effect": "provides diagnostic-context response evidence relevant to the target capacity",
      "confidence_effect": "may raise or lower confidence depending on response quality and consistency",
      "goal_sufficiency_effect": "may inform goal-relative sufficiency only; does not clear the user",
      "high_caution_flag": false,
      "requires_clinician_review": false,
      "safety_context_only": false,
      "diagnostic_context_only": true,
      "notes": "Diagnostic context only; diagnosis remains with RF-DX/RF-SAF rules. Informs evidence only; no progression, readiness, RTT/RTS, or clearance."
    },
    {
      "link_id": "LINK-007",
      "assessment_id": "RF-ASSESS-009",
      "assessment_name": "anterior_thigh_palpation_response",
      "capacity_id": "CAP-010",
      "capacity_name": "anterior_thigh_tissue_load_tolerance",
      "signal_type": "diagnostic_context_only",
      "evidence_effect": "provides diagnostic-context response evidence relevant to the target capacity",
      "confidence_effect": "may raise or lower confidence depending on response quality and consistency",
      "goal_sufficiency_effect": "may inform goal-relative sufficiency only; does not clear the user",
      "high_caution_flag": false,
      "requires_clinician_review": false,
      "safety_context_only": false,
      "diagnostic_context_only": true,
      "notes": "Diagnostic context only; diagnosis remains with RF-DX/RF-SAF rules. Informs evidence only; no progression, readiness, RTT/RTS, or clearance."
    },
    {
      "link_id": "LINK-008",
      "assessment_id": "RF-ASSESS-010",
      "assessment_name": "isometric_strength_capacity_check",
      "capacity_id": "CAP-011",
      "capacity_name": "isometric_strength_capacity",
      "signal_type": "supports_capacity",
      "evidence_effect": "may qualitatively inform evidence_state for the target capacity",
      "confidence_effect": "may raise or lower confidence depending on response quality and consistency",
      "goal_sufficiency_effect": "may inform goal-relative sufficiency only; does not clear the user",
      "high_caution_flag": false,
      "requires_clinician_review": false,
      "safety_context_only": false,
      "diagnostic_context_only": false,
      "notes": "Informs evidence only; does not authorize progression, readiness, RTT/RTS, or clearance."
    },
    {
      "link_id": "LINK-009",
      "assessment_id": "RF-ASSESS-011",
      "assessment_name": "eccentric_strength_capacity_check",
      "capacity_id": "CAP-012",
      "capacity_name": "eccentric_strength_capacity",
      "signal_type": "supports_capacity",
      "evidence_effect": "may qualitatively inform evidence_state for the target capacity",
      "confidence_effect": "may raise or lower confidence depending on response quality and consistency",
      "goal_sufficiency_effect": "may inform goal-relative sufficiency only; does not clear the user",
      "high_caution_flag": false,
      "requires_clinician_review": false,
      "safety_context_only": false,
      "diagnostic_context_only": false,
      "notes": "Informs evidence only; does not authorize progression, readiness, RTT/RTS, or clearance."
    },
    {
      "link_id": "LINK-010",
      "assessment_id": "RF-ASSESS-012",
      "assessment_name": "single_leg_control_observation",
      "capacity_id": "CAP-013",
      "capacity_name": "single_leg_control",
      "signal_type": "supports_capacity",
      "evidence_effect": "may qualitatively inform evidence_state for the target capacity",
      "confidence_effect": "may raise or lower confidence depending on response quality and consistency",
      "goal_sufficiency_effect": "may inform goal-relative sufficiency only; does not clear the user",
      "high_caution_flag": false,
      "requires_clinician_review": false,
      "safety_context_only": false,
      "diagnostic_context_only": false,
      "notes": "Informs evidence only; does not authorize progression, readiness, RTT/RTS, or clearance."
    },
    {
      "link_id": "LINK-011",
      "assessment_id": "RF-ASSESS-012",
      "assessment_name": "single_leg_control_observation",
      "capacity_id": "CAP-014",
      "capacity_name": "lumbopelvic_control",
      "signal_type": "supports_capacity",
      "evidence_effect": "may qualitatively inform evidence_state for the target capacity",
      "confidence_effect": "may raise or lower confidence depending on response quality and consistency",
      "goal_sufficiency_effect": "may inform goal-relative sufficiency only; does not clear the user",
      "high_caution_flag": false,
      "requires_clinician_review": false,
      "safety_context_only": false,
      "diagnostic_context_only": false,